_id,que,choiceA,choiceB,choiceC,choiceD,choiceE,kind,type,source,answer,detail
80269,免疫监视功能低下相关的疾病是,甲状腺功能亢进,重症肌无力,肾小球肾炎,肺癌,脊髓灰质炎,医学免疫学,单选,十门联考,D,免疫监视低下可能导致肿瘤的发生和持续性病毒感染。
80270,小儿骨髓造血器官是,卵巢,胆囊,脾脏,淋巴管,盲肠,医学免疫学,单选,十门联考,C,胚胎时期造血器官。
80271,天然血型抗体是,IgA,IgM,IgG,IgE,IgD,医学免疫学,单选,十门联考,B,IgM构成天然血型抗体，免疫作用强，广（笔记补充）
80272,可用于流行性乙型脑炎早期诊断的实验室检查是,补体结合试验,血凝抑制试验,中和试验,特异性IgM抗体检测,病毒分离,医学免疫学,单选,十门联考,D,无
80273,适应性免疫应答的特点不具有,特异性,非特异性,多样性,记忆性,耐受性,医学免疫学,单选,十门联考,B,适应性免疫应答具有特异性，多样性，记忆性，耐受性
80274,抗体与抗原结合的部位是,VL和VH区,CH1区,CH3区,CH4区,铰链区,医学免疫学,单选,十门联考,A,VH和VL共6个CDR共同组成Ab的抗原结合部位。
80275,溶血空斑试验是用于检测, B细胞, T细胞, 树突状细胞,NK细胞,中性粒细胞,医学免疫学,单选,十门联考,A,B细胞功能测定中抗体形成细胞测定常用溶血空斑试验。
80276,不属于粘膜相关淋巴组织的是,扁桃体,支气管相关淋巴组织, M细胞,腺,小肠派氏集合淋巴结,医学免疫学,单选,十门联考,D,无
80277,B细胞活化过程中的第一信号是, BCR识别Ag,  IL-1的作用, 识别MHC分子,IL-2受体的产生,粘附分子受体与配体的相互作用,医学免疫学,单选,十门联考,A,B细胞活化的第一信号又称抗原刺激信号
80278,一般情况下，难以诱导免疫应答的物质是,蛋白质,糖蛋白,脂多糖,脂类,多糖类,医学免疫学,单选,十门联考,D,一般人是没办法解释，但是我可以。一个抗原要想被识别，激发免疫活动，变成免疫原。那么首先它得被细胞表面的受体识别，而细胞表面的受体主要是蛋白质或者糖蛋白。 所以糖类和蛋白质类的，容易被聚集到受体上面去。（同性才是真爱）而我们的细胞膜，是一层脂双膜，如果是脂类的抗原，接触到细胞膜的时候，就直接穿进去了。在生理上也是一样的，脂类的东西更容易被吸收。
80279,一般不以游离状态存在的是,IgG,IgD,IgE,IgM,IgA,医学免疫学,单选,十门联考,B,人体内的所有物质，基本上就可以分为游离态和结合态。游离态就是只有他自己，结合态就是再加上别的东西。一般来讲，游离态效应会强一点，结合态的比较稳定。所以不能以游离态存在，不是说它没有，而是它的游离态特别不稳定。IgD结构上面，铰链比较长，这个长的话，那么他就容易发生变形，就可以形成各种空 间结构和不同的物质结合。因此它主要在B细胞上面，就是用来识别抗原的。这个铰链容易形变，他也特别容易断，所以在游离情况下，很容易被酶分解，这个知识 点可以参考P30最下面一句话。
80280,ABO血型天然抗体主要是,IgG,IgD,IgE,IgM,IgA,医学免疫学,单选,十门联考,D,ABO血型，我们的红细胞表面，也有蛋白质，在我们自己体内就是正常的，如果到了别人体内，那就是一种抗原了。而自然界中，有一些物质是和我们的血型抗原类似的物质，如果它进入人体，就会激活免疫系统，产生血型抗体。而我们主要参与体液免疫的，就是IgM和IgG。实际上，这两者在血型不溶的免疫反应里面都是有的，不过IgM是在ABO，IgG是在Rh因为IgG分子量比较小，可以穿过胎盘屏障。（它开挂G的，只有他可以。）所以造成新生儿溶血中，Rh的发生率较高。这一块的知识点同时在P150所谓新生儿溶血，就是母亲的抗体经过胎盘屏障进入胎儿体内，结合胎儿红细胞，然后破坏它。我知道你肯定要问为什么ABO的抗体是IgM，也会产生新生儿溶血呢？主要是因为不是所有人的胎盘屏障都是完好的，万一破了，还是会导致一样的情况，不过这种情况相对少见。
80281,多以二聚体的形式存在于外分泌液中的是,IgG,IgD,IgE,IgM,IgA,医学免疫学,单选,十门联考,E,IgA形成二聚体就变成SIgA，二聚体的意思就是两个合在一起，这个S你就当它是super的意思吧。为什么要形成二聚体?类似282题的讲解，就是为了更稳定，它只是自己和自己结合了。所以在母乳中特别多，一开始的时候，新生儿是没有免疫力的，只有通过母乳中的抗体才可以维持免疫。所以这种二聚体从母乳进入新生儿体内，在蛋白酶的作用下就形成2 分子的IgA。自然界很奇妙吧，一切都是刚刚好。
80282,具有分泌片段的是,IgG,IgD,IgE,IgM,IgA,医学免疫学,单选,十门联考,E,分泌片段，顾名思义，这个片段的目的肯定是为了帮抗体分泌出去的，好了我们想想母乳吧，书在P31页
80283,提示新近感染的抗体是,IgG,IgD,IgE,IgM,IgA,医学免疫学,单选,十门联考,D,286.感染参与的抗体，主要是IgG和IgM，前者分子小，后者分子大。为什么要这样？分子大的，那么他就可以形成很多空间结构，就可以适应各种不同的抗原，这在早期感染，机体还没有表达出专门攻克一类抗原的抗体时，是很重要的。而之后就以IgG为主，它分子量小，空间结构比较单一，但是针对性强，相同的原料他可以合成更多特异性的抗体，因此如果是再次同种感染，以IgG为主。
80284,经典途径的C3转化酶是,C4b2b3b,C3bnBb,C3bBb,C4b2b,C56789n,医学免疫学,单选,十门联考,D,补体系统从C1到C9，1到9的中位数是5，同时C5也是补体系统的一个分水岭。而1到5的中位数是3，C3也是一个很重要的阶段。是不是很神奇，不过你要问我5到9的呢？那我就打死你，因为我也不知道。而补体系统最重要的过程就是产生C3和C5的转化酶。经典途径是靠抗原抗体的一个免疫复合物来形成C3转化酶，然后你看一下C3转化酶（C4b2a），气不气，4和2之间正好是3，记住了吗。C4b2a把C3分解之后，变成C4b2a3b，也就是C3转化酶加上一个C3残片，变成了C5转化酶。而旁路途径，激活C3的是C3bBb，所以它的C5转化酶就是C3bBb(+)3b。(这个＋没有的哦，我只是说明他为什么取这个名字。)
80285,旁路途径的C5转化酶是,C4b2b3b,C3bnBb,C3bBb,C4b2b,C56789n,医学免疫学,单选,十门联考,B,所以C3相当于收集来自外界的信号，C5就是开始产生效应的时候。所以就有了攻膜复合物C56789。也就是C5+C6+C7+C8+C9（我解析很喜欢从通过名字来解释的，不要嫌弃，卖个萌。）所以具体怎么选，我就不用一一介绍了吧，前面都有，选项这个破印刷你就当他死了吗。
80286,膜攻击单位是,C4b2b3b,C3bnBb,C3bBb,C4b2b,C56789n,医学免疫学,单选,十门联考,E,无
80287,旁路途径的C3转化酶是,C4b2b3b,C3bnBb,C3bBb,C4b2b,C56789n,医学免疫学,单选,十门联考,C,无
80288,经典途径的C5转化酶是,C4b2b3b,C3bnBb,C3bBb,C4b2b,C56789n,医学免疫学,单选,十门联考,A,无
80289,可与MBL结合的是,CR1,CR2,CR3,CR4,CR5,医学免疫学,单选,十门联考,D,无
80290,主要分布于嗜酸性粒细胞表面的是,CR1,CR2,CR3,CR4,CR5,医学免疫学,单选,十门联考,A,无
80291,辅助I因子裂解C3b的是,CR1,CR2,CR3,CR4,CR5,医学免疫学,单选,十门联考,E,无
80292,主要分布于血小板表面的是,CR1,CR2,CR3,CR4,CR5,医学免疫学,单选,十门联考,B,无
80293,能与EBV结合的是,CR1,CR2,CR3,CR4,CR5,医学免疫学,单选,十门联考,C,"细胞因子书上的分类很奇怪是吧，大致按功能可以分为：参与免疫的细胞因子，参与生长发育的细胞因子。也就是分为：白细胞介素、趋化因子；干扰素、肿瘤坏死因子；生长因子，集落刺激因子。为什么要把参与免疫的细胞因子再分为两类，因为免疫过程包括自身的应答以及抗原的特点，所以把参与免疫的细胞因子分为，作用于自体细胞和作用于抗原的两类细胞因子。而参与生长发育的细胞因子中，生长因子很广泛，可以作用于各类细胞参与生长分化，也就是说它的主要对象是一个个体细胞的成熟。集落刺激因子的英文中有一个colony，这是殖民地的意思。延伸出来就是，他是以一个细胞为核心，向外分裂出很多细胞.因此回到原题：297、298是涉及到细胞增殖的，我们去找集落刺激因子，根据英文不同抗原找到答案，见于书本P51。299/300/301，是关于白细胞活化性的，所以我们考虑白细胞介素。Th1产生IL-2，Th2产生IL-4，也就是乘二的关系，而Th1和Th2都来源于Th0。所以他们是有相互抑制的关系的。（不是直接抑制，不过知道效应就差不多。）Th1的功能是活化T细胞，Th2的功能是活化B细胞。（1,2可以按照一般顺序来，发生免疫反应时，都是先T活化再B活化的。）所以回到题目：IgE是参与过敏反应的抗体，它的直接相关应该是B细胞，由此推出应该是IL-4。参与T细胞活化的，应该是IL-2。可以抑制Th1的是IL-4因为这一组的题目书上很乱，可能是书编的太差了，所以列到的页数太多反而不好。"
80294,促进干细胞增值的是,IL-2,IL-4,SCF,G-CSF,IFN-γ,医学免疫学,单选,十门联考,D,无
80295,促进粒细胞产生的是,IL-2,IL-4,SCF,G-CSF,IFN-γ,医学免疫学,单选,十门联考,B,无
80296,参与IgE产生的细胞因子是,IL-2,IL-4,SCF,G-CSF,IFN-γ,医学免疫学,单选,十门联考,A,无
80297,参与T细胞活化正反馈调节的细胞因子是,IL-2,IL-4,SCF,G-CSF,IFN-γ,医学免疫学,单选,十门联考,B,无
80298,抑制Th1细胞活化的细胞因子是,IL-2,IL-4,SCF,G-CSF,IFN-γ,医学免疫学,单选,十门联考,B,无
80299,属于整合素家族的是,CD61P,CD18,CD28,CD16,CD34,医学免疫学,单选,十门联考,B,无
80300,表达于NK细胞表面的是,CD62P,CD18,CD28,CD16,CD34,医学免疫学,单选,十门联考,D,无
80301,表达于血小板表面的是,CD62P,CD18,CD28,CD16,CD34,医学免疫学,单选,十门联考,A,无
80302,能结合免疫球蛋白Fc段的是,CD62P,CD18,CD28,CD16,CD34,医学免疫学,单选,十门联考,D,无
80303,表达于造血干细胞表面的是,CD62P,CD18,CD28,CD16,CD34,医学免疫学,单选,十门联考,E,无
80304,属于选择素家族的是,CD62P,CD18,CD28,CD16,CD34,医学免疫学,单选,十门联考,A,无
80305,T细胞表面最重要的协同刺激分子,CD62P,CD18,CD28,CD16,CD34,医学免疫学,单选,十门联考,C,无
80306,CD15的受体是,CD62P,CD18,CD28,CD16,CD34,医学免疫学,单选,十门联考,A,无
90001, 麦康凯培养基是一种,细菌培养时形成黑色沉淀物,细菌细胞壁的脂多糖,水溶性色素,脂溶性色素,鉴别培养基,微生物学,单选,十门联考,E,麦康凯培养基用于粪便、分泌物中肠道致病菌及肠球菌的分离培养
90002, 硫化氢试验阳性结果时会出现的现象,细菌培养时形成黑色沉淀物,细菌细胞壁的脂多糖,水溶性色素,脂溶性色素,鉴别培养基,微生物学,单选,十门联考,A,生成黑色硫化物沉淀，是为硫化氢试验阳性
90003,铜绿假单胞菌的绿色色素是,细菌培养时形成黑色沉淀物,细菌细胞壁的脂多糖,水溶性色素,脂溶性色素,鉴别培养基,微生物学,单选,十门联考,C,铜绿假单胞菌产生的水溶性色素诗培养基或脓汁呈绿色
90004,革兰阴性菌的热原质是,细菌培养时形成黑色沉淀物,细菌细胞壁的脂多糖,水溶性色素,脂溶性色素,鉴别培养基,微生物学,单选,十门联考,B,革兰阴性菌致热源即是细胞壁的LPS
90005,溶原性转换,编码性菌毛的质粒,带有前噬菌体基因组的细菌,不锈钢变剂处理而自然发色的突变,利用细菌毒力减弱的变异制成的疫苗,前噬菌体基因组编码的某些生物学性状在宿主菌中表达而引起的基因转移和重组,微生物学,单选,十门联考,E,若前噬菌体使溶原性细菌出现新的生物学性状则称为溶原性转换
90006,卡介苗,编码性菌毛的质粒,带有前噬菌体基因组的细菌,不锈钢变剂处理而自然发色的突变,利用细菌毒力减弱的变异制成的疫苗,前噬菌体基因组编码的某些生物学性状在宿主菌中表达而引起的基因转移和重组,微生物学,单选,十门联考,D,牛型结核分枝杆菌在含有胆汁和甘油的马铃薯培养基中经13年连续传代后获得了毒力减弱但保持免疫原性的变异株，即卡介苗
90007,自发突变,编码性菌毛的质粒,带有前噬菌体基因组的细菌,不锈钢变剂处理而自然发色的突变,利用细菌毒力减弱的变异制成的疫苗,前噬菌体基因组编码的某些生物学性状在宿主菌中表达而引起的基因转移和重组,微生物学,单选,十门联考,C,自发突变是微生物未经人为诱变剂处理或杂交等工程手段而自然发生的突变
90008,溶原性细菌,编码性菌毛的质粒,带有前噬菌体基因组的细菌,不锈钢变剂处理而自然发色的突变,利用细菌毒力减弱的变异制成的疫苗,前噬菌体基因组编码的某些生物学性状在宿主菌中表达而引起的基因转移和重组,微生物学,单选,十门联考,B,带有前噬菌体基因组的细菌称为溶原性细菌
90009,BCG属于,活疫菌,死疫菌,类毒素,抗毒素,转移因子,微生物学,单选,十门联考,A,BCG即卡介苗
90010,预防破伤风用,活疫菌,死疫菌,类毒素,抗毒素,转移因子,微生物学,单选,十门联考,C,常用的类毒素有破伤风类毒素、白喉类毒素
90011,特异性治疗白喉时用,活疫菌,死疫菌,类毒素,抗毒素,转移因子,微生物学,单选,十门联考,D,特异性治疗即人工被动免疫
90012,SPA是其细胞壁上的重要蛋白质组分,金黄色葡萄球菌,肺炎链球菌,甲型溶血性链球菌,乙型溶血性链球菌,淋病奈瑟菌,微生物学,单选,十门联考,A,"SPA为葡萄球菌A蛋白,凝固酶金黄色葡萄球菌最重要的毒力因子"
90013,肠热症的病原体是,大肠埃希菌,痢疾志贺菌,伤寒沙门菌,变形杆菌,霍乱弧菌,微生物学,单选,十门联考,C,肠热症包括伤寒沙门菌引起的伤寒，以及甲型副伤寒沙门菌、肖氏沙门菌和希氏沙门菌引起的副伤寒
90014,作为饮水及食品安全检查的指标菌的是,大肠埃希菌,痢疾志贺菌,伤寒沙门菌,变形杆菌,霍乱弧菌,微生物学,单选,十门联考,A,卫生细菌学检查以“大肠菌群指数”作为判断饮水、食品等被粪便污染的指标之一
90015,可代替立克次体抗原与患者血清发生凝集反应的细菌是,大肠埃希菌,痢疾志贺菌,伤寒沙门菌,变形杆菌,霍乱弧菌,微生物学,单选,十门联考,D,临床上可用普通变形杆菌OX19、OX2和OXK代替立克次体作为抗原，与病人血清进行凝集试验，即外-斐反应，用于辅助诊断相应立克次体病
90016,患者张某，疑似伤寒入院，2次取血做肥达反应的结果如下：入院后第4天结果，THl：80，TO1：80，TA、TB、TC1：40；入院后第十二天，TH、TO1：320，TA、TB、TCl：40，可诊断为, 伤寒, 甲型副伤寒, 乙型副伤寒, 沙门菌早期感染, 回忆反应,微生物学,单选,十门联考,A,O、H升高可诊断伤寒，O及A、B、C其中之一升高可诊断副伤寒甲或乙或丙型。第二份血清H、O效价较第一份血清比≥4，A、B、C抗原不升高，诊断为伤寒
90017,26岁男患者，有不洁性交史和吸毒史，近半年来出现体重下降，腹泻，发热，反复出现口腔真菌感染，初诊为AIDS。确诊时需要参考的主要检测指标是,HIV相应的抗原,HIV相应的抗体,AIDS患者的补体,HIV相关的CD8+细胞,HIV相关的CD4+细胞,微生物学,单选,十门联考,B,HIV抗体检测是诊断HIV感染的常用方法
90018,李某，11岁，因发热水肿、血尿入院，自幼时常咽喉痛，发热，曾因心脏杂音卧床1个月。入院前3周又因咽痛发热而注射青霉素数日，症状消失，但入院前3日又突发高热，血尿，眼睑水肿。入院查体体温39℃，血压稍高，心脏有二级以上收缩期杂音。化验结果：尿红细胞满视野，颗粒管型3～5个／视野，ASO抗体85单位，可疑疾病是 ,急性肾小球肾炎,急急性肾盂肾炎,急急性尿路感染,亚急性细菌性心内膜炎,风湿热,微生物学,单选,十门联考,A,ASO试验用于辅助诊断风湿热或肾小球肾炎，但是风湿热患者ASO抗体一般在250U/mL左右
90019,成年男性患者，使用抗结核药物治疗肺结核数月，1周前出现头部持续性疼痛，3 天前出现发热达38℃左右，今日头痛加重，出现昏迷，检查可见颈强，脑脊液轻度混浊，白细胞数为12×109／L，以淋巴细胞为多见，总蛋白l．5g/L(标准值为0．15—0．45g／L)，集菌涂片镜检可见有芽生孢子和厚荚膜的菌体。除外结核性脑膜炎，最可能的诊断是,自假丝酵母菌性脑膜炎 ,新生隐球菌性脑膜炎 ,流行性脑脊髓膜炎 ,金黄色葡萄球菌性脑膜炎 ,钩端螺旋体性脑膜炎,微生物学,单选,十门联考,B,镜检有芽生孢子和厚荚膜，为真菌性脑膜炎，白假丝酵母菌无荚膜，故为新生隐球菌性脑膜炎
90020,一男性手术时曾输血800ml，1个月后出现恶心、呕吐、黄疸等症状，怀疑为输血后肝炎，进行实验室确诊首先应检查的是,抗-HAV,抗-HCV,抗-HDV,抗-HEV,抗-CMV,微生物学,单选,十门联考,B,HBV和HCV可引起输血后肝炎；CMV引起肝炎少见
90021,一名未接种过卡介苗的健康中年人，做结核菌素试验是阳性，下列哪项解释不正确 ,需要接种卡介苗,不需要接种卡介苗,对结核病有免疫力,细胞免疫功能正常,感染过结核分枝杆菌,微生物学,单选,十门联考,A,阳性表明不需要接种卡介苗
90022,"某患者,发热39℃,脾肝肿大,颈部淋巴结可触及,血液白细胞增多,异型淋巴细胞可检出.印象诊断是传染性单核细胞增多症,引起该病病原体是",腺病毒,丙型肝炎病毒,风疹病毒,巨细胞病毒,EB病毒,微生物学,单选,十门联考,E,传染性单核细胞增多症多由EB病毒感染所致，少数可由巨细胞病毒、腺病毒、肝炎病毒、HIV等引起
90023,男，30岁，1个月前感到疲劳，食欲减少，体重减轻，发烧咳嗽，咯痰带血丝。取标本涂片用抗酸染色法染色，镜下见到染成红色细长弯曲有分枝的杆菌。最可能的病原体是,大肠埃希菌,痢疾志贺菌,伤寒沙门菌,结核分枝杆菌,布鲁菌,微生物学,单选,十门联考,D,结核分枝杆菌抗酸染色菌体呈红色
90024,某单位发生了症状以呕吐为主，腹泻为次的食物中毒，防疫站检查食品等未培养出肠道致病菌，而在炊事员手上查出了化脓感染灶，试问致病菌可能是哪种,鼠伤寒沙门菌,产气荚膜梭菌,金黄色葡萄球菌,肠炎杆菌,副溶血弧菌,微生物学,单选,十门联考,C,金黄色葡萄球菌为化脓性球菌
90025,成年男性患者，被确诊为HIV感染者，消瘦衰竭，经常发生肺感染，造成免疫低下的主要机制是,神经胶质细胞减少,树突状细胞减少,吞噬细胞被破坏,中和抗体保护作用低,CD4+ T细胞大量被破坏,微生物学,单选,十门联考,E,CD4+T细胞是HIV感染的主要的靶细胞
90026,成年男性患者，被确诊为HIV感染者，在对其已妊娠三个月的妻子进行说明过程中，哪项是不正确的,此病可经性交传播,应该立即中止妊娠,此病具有较长潜伏期,应配合患者积极治疗,避免与患者共用餐具,微生物学,单选,十门联考,E,共用餐具不会传播HIV
90027,一名耕种水稻的农民，突然出现高热、乏力，伴有腓肠肌疼痛和眼结膜出血、以及淋巴结肿大，进而出现黄疸。该患者可能是哪种微生物感染,霍乱弧菌,钩端螺旋体,梅毒螺旋体,甲型肝炎病毒,伯氏疏螺旋体,微生物学,单选,十门联考,B,钩端螺旋体引起高热，乏力，头痛，腓肠肌疼痛等，也可有眼结膜充血，浅表淋巴结肿大等体征
90028,"一患者消瘦,反复腹泻。近2周来发热、咳嗽。胸部X线片示两肺渗出性炎症阴影。追问病史，患者承认静脉药瘾和性乱史。为明确诊断，应检查",军团菌抗体,肺炎支原体抗体,肺炎链球菌抗体,HIV抗体,HCNV抗体,微生物学,单选,十门联考,D,HIV可通过血液和性传播
90029,一患儿5岁，发热38.2℃，萎靡瘦弱，营养不良貌。有轻度脑膜刺激征。脑脊液离心沉淀，涂片镜检结果：革兰染色及抗酸染色均未见细菌；但脑脊液沉淀滴加印度墨汁负染后在暗视野下镜检，可见带有宽厚荚膜的圆形、卵圆形菌细胞。有的菌细胞边缘还有芽生孢子状小细胞。最可能的诊断是,肺炎球菌引起的化脓性脑脊髓膜炎 ,脑膜炎双球菌引起的化脓性脑脊髓膜炎,产气荚膜杆菌引起的化脓性脑脊髓膜炎,新型隐球菌引起的慢性化脓性脑膜炎,链球菌引起的慢性化脓性脑膜炎,微生物学,单选,十门联考,D,新型隐球菌墨汁负染后镜检，可见荚膜
90030,某HIV感染者，近日出现继发感染、衰竭、免疫缺陷等AIDS症状，入院治疗。目前认为最有效的治疗方案是,蛋白酶抑制剂,核苷类逆转录酶抑制剂,鸡尾酒疗法(联合用药疗法),阿糖胞苷非核苷类逆转录酶抑制剂,脱氧鸟苷单一用药疗法,微生物学,单选,十门联考,C,鸡尾酒疗法的原理是选择一种蛋白酶抑制剂和两种反转录酶抑制剂联合用药，其余选项都不完全
90031,"一患者呕吐、腹泻,粪便呈米泔水样,不发热。血白细胞正常,脱水明显,血压偏低。引起该病的病原体最可能的是以下哪种微生物",大肠埃希菌,沙门菌,幽门螺杆菌,霍乱弧菌,变形杆菌,微生物学,单选,十门联考,D,霍乱弧菌感染的典型病例是粪便呈米泔水样
90032,男性病人，43岁，剧烈腹泻水样便伴呕吐1天。无腹痛，无里急后重。查体，疲倦面容，皮肤、唇舌干燥，眼窝内陷。血压80/60mmHg.应首先进行如下何种检查来进行初步诊断,便常规,尿常规,取粪便标本立即进行直接悬滴检查,取耳血立即进行直接悬滴检查,碱性蛋白胨水接种,微生物学,单选,十门联考,C,可能感染霍乱弧菌，此菌特点是引起无痛性腹泻，常为米泔水样便，霍乱弧菌耐碱不耐酸。悬滴标本中可见细菌呈穿梭样运动
90033,"一患儿5岁,高热2天,现皮肤出现玫瑰疹,有呕吐、头痛、颈项强直等脑膜刺激症状。脑脊液涂片在中性粒细胞内可见革兰阴双球菌。可能的病原体是",黄金色葡萄球菌,A群链球菌,脑膜炎奈瑟菌,肺炎链球菌,乙型脑炎病毒,微生物学,单选,十门联考,C,选项中只有脑膜炎奈瑟菌为革兰阴双球菌
90034,某新生儿出生7天被确诊为化脓性脑膜炎，下述哪种是最常见的致病菌,脑膜炎奈瑟菌 ,流感杆菌,肺炎球菌,金黄色葡萄球菌 ,B 族链球菌,微生物学,单选,十门联考,A,脑膜炎奈瑟菌是流脑的病原菌
90035,成年男性，体检通过ELISA试验发现血液中HIV抗体阳性。确认实验用, PCR法查DNA, 分离培养病毒, 检测病毒抗原, 蛋白免疫印迹(Western blot), RT-PCR查RNA,微生物学,单选,十门联考,D,确认实验常采用免疫印迹法和间接免疫荧光法和放射免疫沉淀实验等方法
90036,"某幼儿园小朋友，3岁，以发热、咽痛、呼吸困难入院。查体：体温38．5℃、咽部及扁桃体有一层灰白色膜。心率103次/分。实验室检查：白细胞23×10<img src=""13/~9.gif"" />／L，初诊为白喉，试问正确治疗原则是", 注射白喉抗毒素, 注射丙种球蛋白及青霉素, 注射白喉抗毒素及抗生素, 注射白喉类毒素及抗生素, 注射青霉素或红霉素,微生物学,单选,十门联考,C,治疗时除使用抗生素外应尽早注射足量白喉抗毒素
90037,20岁男性患者咳嗽数周。1个月前开始感到疲劳，食欲减少，发热2周后咳痰中带血丝，体重减轻。体温38℃，非急性面容，右上肺有啰音，WBC ll×l09/L，多形核63％，临床怀疑患肺结核，取痰做下列处置，哪项是错误的,做结核菌素试验,痰浓缩集菌涂片进行抗酸染色,PCR查结核分枝杆菌核酸,痰结核分枝杆菌培养,痰培养物接种豚鼠进行动物实验,微生物学,单选,十门联考,A,结核菌素皮肤试验
90038,某患者，男，有不洁性交史，2月前出现生殖器皮肤的无痛性溃疡，1个月后自然愈合，近日出现全身皮肤红疹，伴有淋巴结肿大，该患可能患有何病?,猩红热,麻疹,性病淋巴肉芽肿,风疹,梅毒,微生物学,单选,十门联考,E,感染梅毒后有上述临床表现
90039,某70岁女患者，因尿路感染于10天前开始服用氨苄青霉素。现出现腹泻。取便标本，培养出大量革兰阳性葡萄球菌。试问腹泻发生机制是,菌群失调,肠毒素使腺苷环化酶活性增加,细菌侵袭肠粘膜所致,内毒素作用于肠粘膜,肠蠕动加快,微生物学,单选,十门联考,A,长期大量应用广谱抗生素后，大多数敏感菌和正常菌群被抑制或杀灭，但耐药菌则获得生存优势而大量繁殖致病
