_id,que,choiceA,choiceB,choiceC,choiceD,choiceE,kind,type,source,answer,detail
40256,"体内O2,CO2进出细胞膜是通过 ",单纯扩散,异化扩散,主动运输,渗透,受体介导式入胞,生理学,单选,十门联考,A,经单纯扩散的物质为脂溶性（非极性）物质或少数不带电荷的极性小分子，如O2、CO2、类固醇激素、乙醇、尿素、甘油、水等。故A正确。
40257,体温调节的基本中枢位于 ,大脑皮层,下丘脑,延髓,脊髓,中枢,生理学,单选,十门联考,B,从脊髓到大脑皮层的整个中枢神经系统中都存在参与调节体温的神经元，但对恒温动物进行脑分段横断实验证明，只要保持下丘脑及以下的神经结构完整，动物能维持体温的相对恒定。下丘脑PO/AH机体最重要的体温调节中枢。来自中枢和外周的温度信息汇聚于此，经整合后发出传出信息，使机体产生相应的体温调节反应。故B正确。
40258,心室肌细胞动作电位2期复极的离子基础是 , NA内流，K外流, K外流，CL内流, K外流，CA内流, NA外流，K内流, K内流，CA内流,生理学,单选,十门联考,C,心室肌细胞动作电位2期，即平台期。内向电流中，L型钙电流是最主要的去极化电流，Ca内流；在外向电流中，内向整流钾电流的内向整流特性是造成平台期持续时间较长的重要原因，另一个起重要重要作用的外向电流为延迟整流钾通道，K外流。故C正确。
40259,用阿托品阻断M受体可导致 ,唾液分泌增多,胃液分泌增多,胰液分泌增多,吞咽困难,胃肠运动减弱,生理学,单选,十门联考,E,M受体存在于①大部分副交感神经节后纤维支配的效应器，生理作用：心脏（-）；胃肠平滑肌收缩，消化腺分泌↑；支气管平滑肌和膀胱逼尿肌收缩；虹膜环形肌收缩；胰岛素分泌↑。②少部分交感神经节后纤维支配的效应器（汗腺、骨骼肌舒血管壁），生理作用：汗腺分泌↑；骨骼肌血管舒张。阿托品阻断后，唾液分泌↓；胃液分泌↓；胰液分泌↓；胃肠运动↓。M受体阻断，同时食管下括约肌舒张，利于吞咽。故E正确，其余选项错误。
40260,使胃蛋白酶原转变为胃蛋白酶的激活物是 , NA , CL, K, HCL,内因子,生理学,单选,十门联考,D,胃蛋白酶原以无活性的酶原形式储存在细胞内。进食、迷走神经兴奋及促胃液素等刺激可促进其释放。胃蛋白酶原进入肠腔后，在HCl的作用下，转变成有活性的胃蛋白酶。
40261,下列哪项属于副交感神经的作用 ,瞳孔扩大,糖原分泌增加,逼尿肌收缩,骨骼肌血管舒张,消化道括约肌收缩,生理学,单选,十门联考,C,在外周，M受体分布于大多数副交感节后纤维支配的效应细胞、交感节后纤维支配的汗腺和骨骼肌血管的平滑肌细胞膜上。M受体激活时的效应包括心脏活动抑制，支气管平滑肌、胃肠平滑肌、膀胱逼尿肌、虹膜环形肌收缩，消化腺、汗腺分泌增加和骨骼肌血管舒张等。
40262,发挥体温调定点作用的中枢部位在 ,脑干网状结构,下丘脑弓状核,丘脑特异感觉接替核,视前区-下丘脑前部,延髓下部薄，楔束核,生理学,单选,十门联考,D,2.体温调节中枢部分第四行：下丘脑PO/AH（视前区-下丘脑前部）是机体最重要的体温调节中枢。
40263,体内CO2分压最高的部位是 ,动脉血,静脉血,毛细血管血液,组织液,细胞内液,生理学,单选,十门联考,E,表5-2中组织中PCO₂最高。
40264,加速血液凝固的方法有 ,手术时使用温热的盐水纱布压迫止血,注射肝素,血中加入草酸钾,手术前注射维生K,手术时使用冰盐水纱布压迫止血,生理学,单选,十门联考,A,小字部分：外科手术时常用温热盐水纱布等压迫止血。B.C中肝素、草酸钾是抗凝剂，D是为了减少手术中出血。
40265,窦房结为心脏正常起搏点的原因是 ,静息电位绝对值小,动作电位去极化速度快,动作电位没有1期和2期,4期自动去极速率快,阈电位距静息电位较近,生理学,单选,十门联考,D,4期自动去极化是自律细胞产生自动节律性兴奋的基础。窦房结内起搏细胞4期自极化速度更快，具有更高的自律性起搏频率。
40266,对单一神经纤维动作电位的叙述，错误的是 ,阈下刺激不引起动作电位,电位幅度不随刺激强度的增大而增大,电位幅度随传导距离的增大而有所衰减,在同一细胞上以局部电流形式传导,有髓神经纤维传导速度比无髓纤维快,生理学,单选,十门联考,C,（四）1.第一行：细胞膜某一部分产生的动作电位可沿细胞膜不衰减地传遍整个细胞。
40267,儿茶酚胺类递质包括 ,肾上腺素和去甲肾上腺素,肾上腺素，去甲肾上腺素和5-羟色胺,肾上腺素，去甲肾上腺素和多巴胺,肾上腺素和多巴胺,多巴胺和5-羟色胺,生理学,单选,十门联考,C,单胺类递质包括去甲肾上腺素、肾上腺素、多巴胺、5-羟色胺和组胺等，其中前三者属于儿茶酚胺类。
40268,关于糖皮质激素的作用，下列哪项错误 ,促进全身各部位的脂肪分解,促进肝外组织蛋白分解,促进糖异生,"促进肾保NA,保水",减少外周组织对葡萄糖的利用,生理学,单选,十门联考,A,GC对脂肪组织的主要作用是提高四肢部分的脂肪酶活性，促进脂肪分解，使血浆中脂肪酸浓度增加，并向肝脏转移，增强脂肪酸在肝内的氧化，以利于肝糖原异生。
40269,最大吸气后，从肺内所能呼出的最大气量称为 ,肺总量,深吸气量,补呼气量,时间肺活量,肺活量,生理学,单选,十门联考,E,尽力吸气后，从肺内所能呼出的最大气体量称为肺活量。
40270,肌梭感受器的适宜刺激是 ,梭外肌收缩,梭外肌松弛,梭外肌受牵拉,梭内肌紧张性降低,梭内肌受压迫,生理学,单选,十门联考,C,肌梭是一种长度感受器。当肌肉受外力牵拉而使肌梭感受装置被拉长时，螺旋形末梢发生变形而引起Ⅰa类纤维传入冲动增加。
40271,通气/血流比值是指 , 每分钟通气量与每分钟肺血流量之比,功能余气量与每分钟肺血流量之比,每分钟肺泡通气量与每分钟血流量之比,每分钟最大通气量与每分钟肺血流量之比,肺活量与每分钟毛细血管血流量之比,生理学,单选,十门联考,C,通气/血流比值是指每分钟肺泡通气量和每分钟肺血流量的比值。
40272,CO2在血液中运输的主要形式是 ,和H2O结合形成H2CO3,物理溶解,形成碳酸氢盐,形成HbCO2,以上都不是,生理学,单选,十门联考,C,血液中所含的CO₂约5%以物理溶解的形式运输，其余95%则以化学结合的形式运输。化学结合的形式主要是碳酸氢盐和氨基甲酰血红蛋白，前者约占88%，后者约7%。
40273,蛋白质合成和储存必须的激素是 ,胰高血糖素,胰岛素,氢化可的松,醛固酮,甲状旁腺素,生理学,单选,十门联考,B,胰岛素能促进蛋白质合成和储存，抑制蛋白质的分解。
40274,关于儿茶酚胺与a受体结合后产生的效应，下列哪项错误 ,血管收缩,妊娠子宫收缩,扩瞳肌收缩,小肠平滑肌收缩,竖毛肌收缩,生理学,单选,十门联考,D,NE与α受体（主要是α1受体）结合后产生的平滑肌效应主要是兴奋性的，包括血管、子宫、虹膜辐射状肌等括约肌、竖毛肌的收缩，但也有抑制性的，如小肠舒张（为α2受体）。
40275,在突触传递过程中，促使突触小泡中递质释放的离子是 , CA, K, NA, CL, Mg,生理学,单选,十门联考,A,小而具有致密中心的囊泡，内含儿茶酚胺类递质。
40276,兴奋性突触后电位是指突触后膜出现 ,极化,去极化,超极化,反极化,复极化,生理学,单选,十门联考,B,突触后膜在某种神经递质作用下产生的局部去极化电位变化称为兴奋性突触后电位。
40277,下丘脑是较高级的 ,交感神经中枢,副交感神经中枢,内脏活动调节中枢,躯体运动中枢,交感和副交感中枢,生理学,单选,十门联考,C,（三）第七行：下丘脑是较高级的内脏活动调节中枢。
40278,大量出汗时尿量减少，主要是由于 ,血浆晶体渗透压升高，引起抗利尿激素分泌增加,血浆晶体渗透压降低，引起抗利尿激素分泌增加,交感神经兴奋，引起抗利尿技素分泌增加,血容量减少，导致肾小球滤过减少,血浆胶体渗透压升高，导致肾小球滤过减少,生理学,单选,十门联考,A,大量出汗，循环血量降低，可降低引起血管升压素释放的血浆晶体渗透浓度阈，即提高渗透压感受器对相应刺激的敏感度。
40279,血液流经肾小球时，促进血浆滤出的直接动力是 ,入球小动脉血压,出球小动脉血压,肾动脉血压,肾小球毛细血管血压,全身平均动脉血压,生理学,单选,十门联考,D,肾小球有效滤过压=（肾小球毛细血管静水压+囊内液胶体渗透压）-（血浆胶体渗透压+肾小囊内压）。肾小球毛细血管静水压就等于肾小球毛细血管血压。
40280,促进ACTH释放的下丘脑调节肽是 , GnRH, TRH, GHRH, CRH, GHIH,生理学,单选,十门联考,D,表10-3 ACTH（促肾上腺皮质激素） CRH（促肾上腺皮质激素释放激素）
40281,非特异性投射系统的主要功能是 , 引起特定感觉并激发大脑皮质发出神经冲动,维持和改变大脑皮质的兴奋状态,协调肌紧张,调节随意运动,调节内脏运动,生理学,单选,十门联考,B,非特异投射系统起维持和改变大脑皮层兴奋状态的作用
40282,关于血浆渗透压的叙述，错误的是 ,血浆渗透压约为313mOsm/L,血浆渗透压包括胶体渗透压和晶体渗透压,晶体渗透压大于胶体渗透压,血浆渗透压与0.9%NACL和0.5%葡萄糖溶液的渗透压相等,血浆胶体渗透压在维持血容量中有重要作用,生理学,单选,十门联考,D,5%的葡萄糖溶液为等渗溶液
40283,细胞外液中的葡萄糖进入一般细胞的过程属于 ,单纯扩散,异化扩散,主动转运,入胞式物质转运,受体介导式入胞,生理学,单选,十门联考,B,细胞外液内葡萄糖经载体易化扩散进入胞内
40284,舞蹈病是由于 ,黑质受损,纹状体病变,小脑半球受损,精神分裂症,跳舞引起的损伤,生理学,单选,十门联考,B,亨廷顿病也称舞蹈病，病因是双侧新纹状体病变
40285,肺通气的原动力来自 ,肺内压与胸内压之差,肺内压与大气压之差,肺的弹性回缩,呼吸机舒缩运动,肺内压周期性变化,生理学,单选,十门联考,D,呼吸肌的收缩和舒张所引起的胸廓节律性扩张和缩小，即呼吸运动是实现肺通气的原动力
40286,通过兴奋中枢化学感受器增强肺通气的有效刺激是 ,脑脊液H离子浓度升高,脑脊液CO2分压升高,脑脊液O2分压降低,动脉血H离子浓度升高,动脉血O2分压降低,生理学,单选,十门联考,A,中枢化学感受器的生理性刺激是脑脊液和局部细胞外液中的H+
40287,关于冠脉循环的叙述，错误的是,血流量受心动周期影响，收缩期血流量少，而舒张期血流量多,主动脉压升高，冠脉血压随着升高，血流量增加,等容舒张期血流量迅速大量增加,心动周期缩短，冠脉血流量减少,血流量的调控主要依赖于神经调节,生理学,单选,十门联考,E,CBF主要受心肌代谢水平的影响
40288,胃大部切除患者出现贫血，其主要原因是,HCI减少,黏液减少,内因子减少,HCO3-减少,胃蛋白酶活性减弱,生理学,单选,十门联考,C,胃大部分切除时，机体缺乏内因子，可因维生素B12吸收障碍而导致巨幼红细胞性贫血
40289,神经和骨骼肌细胞动作电位复极化的产生是由于,Na+内流,K+外流,Ca2+内流,Na+外流,K+内流,生理学,单选,十门联考,B,K+外流，引起外向电流，使膜电位增大，发生复极化
40290,降钙素的主要靶器官是,甲状旁腺,肾脏,消化道,骨,腺垂体,生理学,单选,十门联考,D,CT的主要靶器官是骨和肾
40291,滤过分数指,肾小球滤过率/肾血浆流量,肾血浆流量/肾血流量,肾血流量/肾血浆流量,肾小球滤过滤/肾血流量,肾血流量/心排出量,生理学,单选,十门联考,A,肾小球滤过率与肾血浆流量的比值称为滤过分数
40292,若紧闭声门用力呼气，胸内压将升高到100mmHg左右，可以引起下列哪些变化,右心室输出量增加,左心室输出量减少,体循环动脉压下降,心率减慢,心率加快,生理学,单选,十门联考,D,呼气时，心率减慢
40293,关于雄激素的作用，错误的是,刺激雄性副性器官发育并维持成熟状态,刺激男性副性征出现,促进肌肉与骨骼生长，使男子身高在青春期呈冲刺式生长,分泌过盛可使男子身高超出常人,维持正常的性欲,生理学,单选,十门联考,D,雄激素只能加速机体生长
40294,导致氧离曲线右移的原因是,血液中H+浓度降低,体温下降,血液中CO2分压下降,血浆中pH下降 ,CO中毒,生理学,单选,十门联考,D,"氧离曲线右移：PCO2升高，pH下降，2,3-DPG增加，温度升高"
40295,在细胞膜蛋白质的帮助下，物质顺浓度差或电位差的转运方式是,单纯扩散,易化扩散,出胞作用,原发性主动转运,继发性主动转运,生理学,单选,十门联考,B,在膜蛋白的帮助（或介导）下，非脂溶性的小分子物质或带电离子顺浓度梯度和（或）电位梯度进行的跨膜转运，称为易化扩散
40296,由平卧位突然站立，静脉回心血量减少，每搏输出量减少、动脉血压降低，是由于下列哪项引起,等长调节,异长调节,心室后负荷增大,心交感神经兴奋,心迷走神经兴奋,生理学,单选,十门联考,B,异长自身调节：体位改变，动脉血压突然改变，心率改变，左右心室搏出量不平衡
40297,调节胰岛素分泌的最重要因素是,血糖水平,血中氨基酸水平,血脂水平,血钙水平,血钾水平,生理学,单选,十门联考,A,血中葡萄糖水平是调节胰岛素分泌最重要的因素
40298,心输出量是指,一次心跳由两侧心室射出的血量之和,一次心跳由一侧心室射出的血量,每分钟由一侧心房射出的血量,每分钟由一侧心室射出的血量,每分钟由两侧心室射出的血量之和,生理学,单选,十门联考,D,一侧心室每分钟射出的血液量，称为每分输出量，也称心输出量或心排出量
40299,下列关于中心静脉压的描述，哪一项是不正确的,是指胸腔大静脉和右心房的血压,心脏射血能力减弱时，中心静脉压较低,正常变化范围为0.4~1.2kPa（4~12cmH2O）,是反映心脏功能的一项指标,静脉输液量大且过快时，中心静脉压升高,生理学,单选,十门联考,B,心脏射血能力减弱，右心房和腔静脉淤血，中心静脉压升高
40300,血清与血浆的主要区别在于血清缺乏,纤维蛋白,纤维蛋白原,凝血因子,血小板,Ca2+,生理学,单选,十门联考,B,血清无纤维蛋白原
40301,心脏中传导速度最快的组织是,窦房结,心房优势传导通路,房室交界,心室肌,浦肯野纤维,生理学,单选,十门联考,E,倒数第二行原话
40302,有关胸内压的叙述，错误的是,一般情况下是负压,胸内压=肺内压-肺回缩力,胸内负压有利于静脉回流,使肺维持一定的扩张程度,产生气胸时负压增大,生理学,单选,十门联考,E,AD155原话，BCE见于156页胸膜腔负压意义（气胸负压减小或消失） 
40303,在下列哪一种情况下，心交感神经的活动会减弱,情绪兴奋时,动脉血压降低时,血容量减少时,颈动脉窦和主动脉弓压力感受性反射增强时,容量感受性反射增强时,生理学,单选,十门联考,D,"ABC心交感神经兴奋（三正）,DE均可引起迷走兴奋交感抑制，但E未提及“心”"
40304,机体受到刺激而发生应激反应的系统是,交感-肾上腺髓质,下丘脑-腺垂体-肾上腺皮质系统,下丘脑-腺垂体-性腺系统,下丘脑-腺垂体-甲状腺系统,下丘脑-腺垂体-肾上腺髓质系统,生理学,多选,十门联考,AB,应激时AB两系统均起作用，A主要引起应急反应，B主要引起应激作用，；两者均可在应激原刺激下产生作用（详见郭益明给的图）
40305,副交感神经兴奋可引起,瞳孔扩大,糖原分解,胃肠运动增强,骨骼肌血管扩张,竖毛肌收缩,生理学,单选,十门联考,C,倒数三行
40306,关于月经周期的叙述，错误的是,月经周期中，女性生殖系统会出现周期性变化,软超周期分为卵泡期和黄体期,子宫内膜周期分为增殖期、分泌期和月经期,月经周期中出现两次雌激素分泌高峰,排卵的发生主要与FSH高分和孕激素高峰出现有关,生理学,单选,十门联考,E,"E排卵FSH,LH（黄体生成素）高峰，非孕激素"
40307,大量饮清水后，尿量增多主要是由于,肾小球毛细血管血压升高,醛固酮分泌减少,血浆胶体渗透压下降,血浆晶体渗透压下降,肾小球滤过率增加,生理学,单选,十门联考,D,倒数第八行
40308,心室肌的前负荷是指,收缩末期心室容积,舒张末期心室容积,快速射血期末心室容积,等容舒张期心室容积,快速充盈期心室容积,生理学,单选,十门联考,B,第四节第六行
40309,特异性投射系统的主要功能是,引起特定感觉并激发大脑皮质发出神经冲动,维持和改变大脑皮质的兴奋状态,协调肌紧张,调节内脏功能,维持觉醒,生理学,单选,十门联考,A,第五行
40310,我国健康成年人安静时白细胞总数是,（10~30）×109/L,500×109/L,（4~10）×109/L,（100~1000）×109/L,小于10×109/L,生理学,单选,十门联考,C,第三行
40311,决定每分钟肺泡通气量的因素是,呼吸频率和无效腔的大小,余气量的多少,肺活量,潮气量的大小,呼吸频率，潮气量与无效腔的大小,生理学,单选,十门联考,E,第17行
40312,心室肌的初长可用下列何者来间接表示,等容收缩期容积或压力,等容舒张期容积或压力,舒张末期容积或压力,舒张末期主动脉压,快速充盈期容积或压力,生理学,单选,十门联考,C,第四节第5行
40313,动作电位上升支Na+内流是属于,单纯扩散,载体转运,通道转运,主动转运,出胞作用,生理学,单选,十门联考,C,第5行
40314,交感神经节后纤维释放的递质是,乙酰胆碱,去甲肾上腺素,多巴胺,去甲肾上腺素或乙酰胆碱,5-羟色胺,生理学,单选,十门联考,D,285第三节第7行，286第15行
40315,具有局部电位信号特征的电信号是,神经与动作电位,神经纤维动作电位,峰电位,终板电位,骨骼肌细胞动作电位,生理学,单选,十门联考,D,倒数第5行，局部电位叠加课形成动作电位
40316,肾小球滤过的动力有效滤过压等于,肾小球毛细血管血压-血浆胶体渗透压+囊内压,肾小球毛细血管血压-（血浆胶体渗透压+囊内压）,肾小球毛细血管血压+血浆胶体渗透压-囊内压,肾小球毛细血管血压-血浆晶体渗透压-囊内压,肾小球毛细血管血压+血浆胶体渗透压+囊内压,生理学,单选,十门联考,B,空
40317,缺O2增强呼吸运动主要是通过刺激,外周化学感受器,中枢化学感受器,延髓呼吸中枢,脑桥呼吸中枢,下丘脑呼吸中枢,生理学,单选,十门联考,A,A（血氧、二氧化碳分压、氢离子浓度）B（脑脊液和局部细胞外的氢离子浓度）
40318,睾酮由下列哪种细胞分泌,间质细胞,支持细胞,初级精母细胞,次级精母细胞,精原细胞,生理学,单选,十门联考,A,B（抑制素）
40319,生长素分泌有日周期，血中浓度最高的时间是在,清晨,中午,傍晚,慢波睡眠,异相睡眠,生理学,单选,十门联考,D,生长激素在觉醒时分泌少，在慢波睡眠增加，入睡后60min达到高峰。异相睡眠分泌减少。C（入睡后80-120min，分泌生长激素，促进生长发育）D（慢波睡眠后20-30min）
40320,关于钠泵生理作用，错误的描述是,钠泵能逆浓度差将进入到细胞内Na+移出细胞外,钠泵能顺着浓度差使细胞外的K+移入细胞内,钠泵每分解1分子ATP可排除3个Na+，转入2个K+,钠泵活动走啊称细胞内高K+，使许多生理活动得以进行,钠泵活动可以造成膜两侧的离子势能储备,生理学,单选,十门联考,B,B（钠泵属于主动转运，逆浓度梯度转运）
40321,ADH主要由何处合成,腺垂体,神经垂体,下丘脑视上核,下丘脑室旁核,肾脏,生理学,单选,十门联考,C,ADH：抗利尿激素。由下丘脑视上核和视旁核合成。
40322,大多数细胞产生静息电位的原因是,细胞内高K+浓度和安静时膜主要对K+有通透性,细胞内高K+浓度和安静时膜主要对Na+有通透性,细胞外高Na+浓度和安静时膜主要对Na+有通透性,细胞外高Na+浓度和安静时膜主要对K+有通透性,Na+-K+泵的活性,生理学,单选,十门联考,A,钾离子的电位平衡
40323,关于心室肌细胞运作电位离子基础的叙述，错误的是,0期主要由Na+内流形成,1期主要由Cl-外流形成,2期主要由Ca2+内流和K+外流形成,3期主要由K+外流形成,4期主要由Na+外流和K+内流形成,生理学,单选,十门联考,B,B（1期由钾离子外流形成）
40324,正常情况下消化道吸收水分的主要部位是,胃,十二指肠,小肠,升结肠,降结肠,生理学,单选,十门联考,B,小肠是吸收的主要部位，糖、蛋白质、脂肪的分解产物主要由十二指肠和空肠上部吸收。
40325,影响舒张压的主要因素是,大动脉管壁的弹性,心输出量,阻力血管的口径,血液粘滞度,血管长度,生理学,单选,十门联考,C,舒张压主要受外周阻力影响，外周阻力与阻力血管的口径的4次方成反比。
40326,调节血钙浓度最主要的激素是,生长素,降钙素,甲状腺激素,甲状旁腺激素,肾上腺皮质激素,生理学,单选,十门联考,D,A（促进生长）B（抑制破骨细胞骨吸收、骨转换）C（促进新陈代谢）E（糖、蛋白质、脂肪代谢）
40327,心动周期中左心室容积最大的时期是,快速射血期末,快速充盈期末,减慢充盈期末,减慢射血期末,房缩期末,生理学,单选,十门联考,E,A（室内压、动脉压最大）B（室内压最低）
50001,下列有关酶的正确论述是,不能在胞外发挥作用,大多数酶的化学本质是核酸,能改变反应的平衡点,能大大降低反应的平衡点,与底物的结合都具有绝对特异性,生物化学,单选,十门联考,D,【本题无正确答案】酶是由活细胞产生的、对其底物具有高度特异性和高度催化效能的蛋白质；酶可以降低反应活化能（但不改变反应平衡点）；酶对底物的特异性分为两种类型：绝对专一性和相对专一性
50002,下列哪项不是限制性内切酶识别序列的特点,特异性很高,常由4~6个核苷酸组成,一般具有回文结构,少数内切酶识别序列中的碱基可以有规律地替换,限制性核酸内切酶的切口均是粘性末端,生物化学,单选,十门联考,E,粘性末端
50003,5—FU是哪种碱基的类似物,A,U,C,G,T,生物化学,单选,十门联考,E,最后一段
50004,白喉毒素对真核生物有剧烈毒性是因为它可以共价修饰下列哪种因子,EF—2,eEF—2,EF—1,eIF-2, eIF – 5,生物化学,单选,十门联考,B,作为一种修饰酶，可使eEf-2发生ADP糖基化共价修饰而失活。
50005,乳酸循环不经过下列哪条途径,糖酵解,糖异生,磷酸戊糖途径,肝糖原分解,肝糖原合成,生物化学,单选,十门联考,C,图6-16
50006,癌基因表达产物的作用中不包括的是,生长因子,生长因子受体,DNA结合蛋白,G蛋白结合蛋白,具有蛋白酪氨酸激酶活性,生物化学,单选,十门联考,D,见书
50007,白化病患者体内缺乏的酶是,苯丙氨酸转氨酶,酸转氨酶,酸羟化酶,酪氨酸酶,多巴脱羟酶,生物化学,单选,十门联考,D,在黑色素细胞中，酪氨酸经酪氨酸酶作用，羟化形成多巴，后者经氧化、脱羧等反应转变成吲哚醌，最后吲哚醌聚合为黑色素。先天性酪氨酸酶缺乏的病人，因不能合成黑色素，皮肤毛发等发白，称为白化病。
50008,在胆固醇逆向转运中起主要作用的血浆脂蛋白是,LDL, HDL,LDL,HDL,.CM,生物化学,单选,十门联考,B,新生HDL的代谢过程实际上就是胆固醇逆向转运过程。
50009,成熟的真核生物mRNA5’端具有的结构是,polyA, m7ApppN,m7GpppN,m7CpppN,m7UpppN,生物化学,单选,十门联考,C,见书
50010,当缺乏时可以引起巨幼红细胞贫血的维生素是,维生素B1,维生素B12,维生素C, 生物素,泛酸,生物化学,单选,十门联考,B,当B12缺乏时，核酸合成障碍阻止细胞分裂而产生巨幼细胞性贫血。
50011,体内两条电子传递链分别以不同递氢体起始，经呼吸链最后将电子传递成氢，生成水，这两条电子传递链的交叉点是,CytB,FAD,FMN,CytC,CoQ,生物化学,单选,十门联考,E,体内有两条电子传递链，一条是以NADH 为起始的，另—条以FAD 为起始的电子传递链。两条电子传递链的顺序分别为 NADH，FMN，辅酶Q，Cytb，Cytc，Cytaa3，O2 和FADH2，辅酶Q，Cytb，Cytc， Cytaa3，O2。 
50012,脂肪酸β—氧化酶系存在于,胞质,微粒体,溶酶体,线粒体,内质网,生物化学,单选,十门联考,D,催化脂肪氧化（β氧化）的酶系存在于线粒体基质。
