_id,que,choiceA,choiceB,choiceC,choiceD,choiceE,kind,type,source,answer,detail
70066,不符合浸润性结核病的描述是,属于无活动性肺结核,常发生干酪样坏死,常伴有全身症状,可引起干酪样肺炎,可经纤维化、钙化痊愈,病理学,单选,十门联考,A,浸润性肺结核是临床上最常见的活动性、继发性肺结核。故A不符合。
70067,慢性胃溃疡最常见的合并症是,幽门狭窄,穿孔,出血,癌变,粘连,病理学,单选,十门联考,C,并发症中出血约占患者10～35％，比例最大
70068,脓细胞是,转化的淋巴细胞,含Russell小体的浆细胞,吞噬脂质的巨噬细胞,变性坏死的中性粒细胞,变性坏死的嗜酸性粒细胞,病理学,单选,十门联考,D,化脓性炎中：脓液中的中性粒细胞除极少数仍有吞噬能力外，大多数细胞已发生变性和坏死，这些变性、坏死的中性粒细胞称为脓细胞。
70069,急性感染性心内膜炎的瓣膜赘生物的成分不包括,大量肉芽组织,大量细菌,大量坏死组织,大量中性粒细胞,大量血小板及纤维蛋白,病理学,单选,十门联考,A,急性感染性心内膜炎，赘生物主要由脓性渗出物、血栓、坏死组织和大量细菌菌落混合而形成。D项大量中性粒细胞属于脓性渗出物，E项大量血小板及纤维蛋白属于血栓成分，故A不包括。
70070,肝泡状棘球蚴病不会出现下列哪些病变,无数小囊泡集合形成海绵体,小囊泡间组织坏死,囊肿周围无纤维包膜,单个大囊泡破裂引起过敏性休克,外生性子囊可生长侵入周围组织及血管、淋巴管,病理学,单选,十门联考,D,棘球蚴病可分为细粒棘球蚴病和泡状棘球蚴病。D项属于细粒棘球蚴病的病变。泡状棘球蚴病不形成大囊泡。
70071,下列器官坏死，哪一种属于液化性坏死,心脏,肾脏,肝脏,脾脏,脑,病理学,单选,十门联考,E,液化性坏死，见于细菌或某些真菌感染引起的脓肿，缺血缺氧引起的脑软化，以及由细胞水肿发展而来的溶解性坏死等。
70072,下列哪项是诊断恶性肿瘤的主要依据,肿瘤体积大,有大片坏死,肿瘤细胞的异型性明显或瘤细胞原始幼稚,肿瘤有溃疡形成,老年人进行性消瘦,病理学,单选,十门联考,C,异型性是肿瘤组织和细胞出现成熟障碍和分化障碍的表现，是区分良恶性肿瘤的重要指标。
70073,急性痢疾典型的肠道炎病变是,卡他性炎,假膜性炎,化脓性炎,浆液性炎,出血坏死性炎,病理学,单选,十门联考,B,急性细菌性痢疾其典型病变过程为初期的急性卡他性炎，随后的特征性假膜性炎和溃疡形成，最后痊愈。
70074,上消化道出血，可表现为呕吐及黑便，主要取决于,凝血机制,出血部位和高低,病变的性质,出血的速度和量,胃肠蠕动情况,病理学,单选,十门联考,D,原话：临床表现为呕血还是便血以及血的颜色主要取决于出血的速度和出血量的多少，而出血部位高低是次要的。
70075,最多见的肝癌是,肝细胞癌,胆管上皮癌,低分化腺癌,混合性肝癌,鳞癌,病理学,单选,十门联考,A,镜下有三种组织类型：①肝细胞癌：发生于肝细胞，最多见。②胆管细胞癌③混合细胞型肝癌
70076,阿米巴病的主要累及部位是,结肠,肝,肺,脑,皮肤,病理学,单选,十门联考,A,病变部位主要在盲肠和升结肠，其次为乙状结肠和直肠
70077,下列哪个器官的梗死灶常为地图形,肺脏,心脏,肝脏,脾脏,肠管,病理学,单选,十门联考,B,心冠状动脉分支不规则，故心肌梗死灶的形状也不规则，呈地图状。
70078,慢性阑尾炎手术治疗，原则上术中应,探查肝脏,放置引流管,冲洗腹腔,无需探查,探查末端回肠,病理学,单选,十门联考,E,外科学上的慢性阑尾炎也是一笔带过的。但参考急性阑尾炎的术后并发症，笔者猜测可能是为了防止粘连性肠梗阻。
70079,关于腹部穿透伤的描述中错误的是,穿透伤的入口或出口可能不在腹部而在胸、肩、腰、臀或会阴,有些腹壁切线伤虽未穿透腹膜，但并不排除内脏损伤的可能,穿透伤的入、出口与伤道不一定呈直线,伤口大小与伤情严重程度不一定成正比,创口小的穿透性损伤不需要剖腹探查,病理学,单选,十门联考,E,伤口大小与伤情严重程度不一定成正比。故E错
70080,关于暴发型流脑，下述哪项错误,高热、头痛伴呕吐,常见周围循环衰竭,皮肤黏膜广泛淤点淤斑,蛛网膜下腔大量脓细胞,双侧肾上腺出血,病理学,单选,十门联考,D,332页的流行性脑脊髓膜炎中提到了发热、头痛及呕吐。333页暴发型流脑中提到短期即出现皮肤和粘膜的广泛性出血点和瘀斑及周围循环衰竭等严重临床表现。以及双侧肾上腺广泛出血以及急性肾上腺功能衰竭。且脑膜炎炎症病变较轻，主要为败血症性休克。
70081,日本血吸虫病引起肝硬化为,门脉性肝硬化,胆汁性肝硬化,坏死后性肝硬化,淤血性肝硬化,干线性肝硬化,病理学,单选,十门联考,E,血吸虫在肝脏的病变，慢性期切面上，增生的结缔组织沿门静脉分支呈树枝状分布，故称为干线型或管道型肝硬化。故选E
70082,下列哪种疾病属于急性增生性炎,白喉,病毒性肝炎,伤害,绒毛心,肝脓肿,病理学,单选,十门联考,C,A.白喉：伪膜性炎（纤维素性炎的一种） B.病毒性肝炎：有数种病理表现（细胞变性坏死）D.绒毛心：纤维素性炎 E.肝脓肿：化脓性炎。C.伤寒：急性增生性炎（增生性炎症以慢性为主，但伤寒和急性肾炎是特例）故选C
70083,慢性肾盂肾炎的主要病变特点是,呈颗粒性固缩肾,肾间质充血，水肿，大量中性粒细胞浸润,肾小球纤维化,肾小动脉壁常有纤维素样坏死,肾脏有凹陷性不正常瘢痕，肾盂肾盏变形,病理学,单选,十门联考,E,慢性肾盂肾炎大体改变的特征是一侧或双侧肾脏体积缩小，出现不规则的瘢痕。肾盏和肾盂因瘢痕收缩而变形。故选E（A、C见于慢性肾小球肾炎；B见于急性肾盂肾炎；D见于急性弥漫性增生性肾小球肾炎。）
70084,在电镜下萎缩细胞可出现,肌丝增多,线粒体增多,滑面内质网增多,自噬泡增多,粗面内质网增多,病理学,单选,十门联考,D,萎缩的形态表现为萎缩细胞胞浆内的细胞器大量退化，因而线粒体和内质网减少，但溶酶体增多，吞噬自身物质形成许多自噬泡。被吞噬的细胞器和生物大分子先要被内质网的膜包裹起来形成自噬泡。故选D
70085,具有调理化作用的炎性介质是,组胺,C5a,C3b,缓激肽,活化氧代谢产物,病理学,单选,十门联考,C,A组胺，扩毛细血管作用；B C5a，激活白细胞作用；C C3b，调理作用；D缓激肽，扩血管作用；E活化氧代谢产物，加强炎症反应。故选C
70086,急性细菌性痢疾患者的里急后重症状的根本原因是,肠蠕动增强,肠痉挛,肠扭转,肠壁溃疡,炎症刺激直肠壁内的神经末梢及肝门括约肌,病理学,单选,十门联考,E,由于炎症刺激直肠壁内的神经末梢及肛门括约肌，导致里急后重和排便次数增多。故选E
70087,对急性阑尾炎有诊断价值的辅助检查是,B超,钡灌肠,结肠镜,乙状结肠镜,肠系膜血管造影,病理学,单选,十门联考,A,急性阑尾炎的诊断主要依靠病史、临床症状、体检所见、实验室检查、影像检查（腹部平片、超声检查、螺旋CT）、腹腔镜检查。出A外其余选项均未提及。
70088,慢性支气管炎患者发生阻塞性通气功能障碍的病变基础是,支气管上皮细胞变性、坏死,支气管平滑肌萎缩,支气管软骨萎缩、纤维化,细支气管炎及细支气管周围炎,支气管腺体增生、肥大,病理学,单选,十门联考,D,细支气管炎和细支气管周围炎是引起慢性阻塞性肺气肿的病变基础。故选D
70089,风湿性病变中，对集体危害最大的是,反复发作的风湿性关节炎,反复发作的环形红斑,反复发作的风湿性心内膜炎,风湿性皮下结节,风湿性动脉炎,病理学,单选,十门联考,C,风湿病变常累及心脏、关节和血管处，以心脏病变最为严重
70090,对风湿性最具病理诊断意义的病变是,纤维素样变性,风湿小结,心肌变性,纤维素渗出,纤维组织增生,病理学,单选,十门联考,B,风湿病的特征性病理变化为风湿小体，即Aschoff小体，对诊断风湿病有意义。故选B
70091,慢性肾盂肾炎形态变化可能性最小的是,肾间质纤维化,肾小球囊周围纤维化,肾小球代偿性肥大,肾小管内见淋巴细胞,肾盂黏膜纤维化,病理学,单选,十门联考,D,慢性肾盂肾炎的病变特点是慢性间质性炎症、纤维化和瘢痕形成，常伴有肾盂和肾盏的纤维化和变形。早期肾小球很少受累，肾球囊周围可发生纤维化，故A、B、E正确。部分肾小球球囊壁增厚，部分肾小管扩张，故肾小球可代偿性肥大，故C正确。慢性肾盂肾炎急性发作时出现大量中性粒细胞，而非淋巴细胞，故D错误。故选D
70092,易并发肠道癌肿的疾病是,慢性阿米巴痢疾,十二指肠溃疡,肠结核,肠伤寒,慢性肠血吸虫病,病理学,单选,十门联考,E,血吸虫虫卵可沉着于结肠，慢性期部分病例可并发管状或绒毛状腺瘤甚至腺癌；P211大肠癌的病因与发病学第3点
70093,弥漫性硬化性肾小球肾炎的肾脏表现为,大红肾,颗粒性固缩肾,大白肾,蚤咬肾,大瘢痕性固缩肾,病理学,单选,十门联考,B,慢性肾小球肾炎又称慢性硬化性肾小球肾炎：继发性颗粒性固缩肾（p273），故选B(急性弥漫性增生性肾小球肾炎：大红肾、蚤咬肾（p266）；膜性肾小球病：大白肾（p269)。）
70094,脂性肾病光镜下的特点是,肾小球细膜区增宽,肾小管上皮细胞空泡变,肾小球毛细血管基膜和球囊壁粘连,肾小球无明显变化,肾小球的求囊壁增厚,病理学,单选,十门联考,D,微小病变性肾小球病，病变特点是弥漫性肾小球脏层上皮细胞足突消失。光镜下肾小球基本正常，肾小管上皮细胞内有脂质沉积，故有脂性肾病之称。故选D
70095,下列关于结核性腹膜炎描述错误的是,结核性腹膜炎一般起病缓慢，早期症状较轻,早期就有剧烈腹痛，可以表现为急腹症,腹泻常见，每日3~4次，多为糊状,常在脐周可以触及包块,PPD实验常强阳性,病理学,单选,十门联考,B,结核性腹膜炎多起病缓慢，早期症状较轻，B错误。故选B
70096,严重肝硬化脂肪变性的肝脏肉眼改变是,槟榔肝,急性黄色干萎缩,肝大、切面淡黄、油腻感,肝脏变小、质硬，表面细颗粒状,肝脏呈多结节状,病理学,单选,十门联考,C,随着病变的加重，脂肪变的器官体积增大，淡黄色，边缘圆钝，切面呈油腻感。故选C
70097,梅毒特征性病理变化是,形成肿瘤,组织坏死,树胶肿,大量巨噬细胞,大量的中性粒细胞,病理学,单选,十门联考,C,树胶样肿又称梅毒瘤，是第三期梅毒的特征性病理变化。故选C
70098,急性炎症是，组织肿胀的主要原因是,纤维组织增生,血液成分渗出,肉芽组织增生,实质细胞增生,实质细胞变质,病理学,单选,十门联考,B,炎症局部组织血管内的液体成分，纤维素等蛋白质和各种炎细胞通过血管壁进入组织间隙、体腔、体表和粘膜表面的过程称为渗出，渗出液在组织间隙集聚，称为炎性水肿。故选B
70099,肺动脉栓塞引起猝死的原因不包括哪一项,肺动脉痉挛,支气管动脉痉挛,支气管痉挛,肺出血性梗死,冠状动脉痉挛,病理学,单选,十门联考,D,肺动脉栓塞时，重者肺循环阻力突然增加(C.支气管痉挛），肺动脉压突然升高（A.肺动脉痉挛、B.支气管动脉痉挛），心脏排血量急骤下降，患者出现休克、脑血管和冠状血管供血不足（E.冠状动脉痉挛），导致晕厥，甚致死亡。肺出血性梗死要存在严重淤血为条件，故选D
70100,上消化道大出血的临床表现中，呕血还是便血主要取决于,出血部位,出血速度和出血量,肠蠕动,凝血功能情况,血液在胃肠道内停滞时间,病理学,单选,十门联考,B,原话：临床表现为呕血还是便血以及血的颜色主要取决于出血的速度和出血量的多少，而出血部位高低是次要的。
70101,下列哪一项不符合慢性阑尾炎的临床表现,长期右下腹疼痛,急性阑尾炎发作病史,右下腹固定的压痛,钡灌肠阑尾不显影,便血,病理学,单选,十门联考,E,按书中原话可知A、B、C选项正确。慢性阑尾炎主要病变是阑尾壁的不同程度纤维化及慢性炎细胞浸润，故E项错误。D选项超纲，见外科学P392：X线钡灌肠透视检查，可见阑尾不充盈或充盈不全，阑尾腔不规则。72小时候透视复查阑尾腔内仍有钡剂残留，即可诊断慢性阑尾炎。
70102,肝内胆道出血时，胆囊可出现,脓肿形成,坏死,胆囊穿孔,缩小,肿大,病理学,单选,十门联考,E,但书上未提及胆囊变化。但结合医学常识及排除法选择E。
70103,完成瘢痕修复的物质基础是,上皮组织,肉芽组织,毛细血管网,.纤维蛋白网架,炎性渗出物,病理学,单选,十门联考,B,书中原话
70104,结节性甲状腺肿的肉眼特点是,甲状腺弥漫肿大、光滑、质软,甲状腺弥漫肿大、多结节状,甲状腺轻度肿大、质硬,甲状腺内单一结节形成、质软、边界清楚,甲状腺内单一结节形成、质硬、边界不清,病理学,单选,十门联考,B,单纯性甲状腺肿结节期，按书中原话可知A、C、D、E选项描述不完整，B选项描述正确
70105,不符合2型糖尿病的描述是,多为中老年患者,无抗胰岛细胞抗体,胰岛数目正常或轻度减少,血胰岛素水平明显降低,肥胖是重要因素,病理学,单选,十门联考,D,按书中原话，A、B、C、E选项正确，“血中胰岛素可正常、增多或降低”因此B选项错误。
70106,良性肿瘤的异型性主要表现在,瘤细胞的多形性,瘤细胞核的多形性,组织结构极性消失,病理性核分裂象,核质比值明显增大,病理学,单选,十门联考,C,异型性指肿瘤组织结构和细胞形态与相应的正常组织有不同程度的差异。良性肿瘤异型性较小，恶性肿瘤异型性较大。A、B、D、E选项为恶性肿瘤，C选项为良性肿瘤，故选C。
70107,炎症病灶中纤维蛋白的作用是,引起血浆凝固,有利于白细胞发挥吞噬作用,有利于细菌扩散,促进组织增生,调理作用,病理学,单选,十门联考,B,书中原话
70108,肠阿米巴病的溃疡特点是,不规则地图状溃疡,鼠咬样边缘带状溃疡,漏斗状溃疡,火山口状大溃疡,口小底大烧瓶状溃疡,病理学,单选,十门联考,E,P360急性细菌性痢疾A项，P369阿米巴病急性期病变E项
70109,肝细胞气球样变属于,水变性,脂肪变性,玻璃样变性,淀粉样变性,纤维素样变性,病理学,单选,十门联考,A,脂肪变多发于肝细胞
70110,慢性支气管炎的病变不包括下列哪项,黏膜上皮磷化,支气管腺体和杯状细胞增生,支气管内有多量泡沫细胞,支气管壁有大量慢性炎症细胞浸润,支气管软骨变性、萎缩,病理学,单选,十门联考,C,按书中原话，A、B、D、E选项正确。无泡沫细胞故C项错误。
70111,引起上消化道大出血最常见的原因是,胃十二指肠炎溃疡,肝硬化食管静脉曲张破裂,出血性胃炎,胆道出血,胃癌破裂出血,病理学,单选,十门联考,A,上消化道出血最常见的病因是消化性溃疡，因此A选项正确。
70112,阿米巴肝脓肿病变中一般见不到,肝大,脓腔内容物呈果酱样,脓肿壁呈破絮状,病变组织中可见阿米巴滋养体,病变组织中有大量变性、坏死的中性粒细胞,病理学,单选,十门联考,E,A、B、C、D选项书中有原话，一般阿米巴肝脓肿镜下有少许炎细胞浸润，如伴有细菌感染可见病灶内有大量中性粒细胞和脓细胞。故选E。
70113,结核结节的主要细胞成分是,纤维母细胞,类上皮细胞,Langhans巨细胞,淋巴细胞,中性粒细胞,病理学,单选,十门联考,B,书中原话
70114,弥漫性毛细血管内增生性肾小球肾炎最主要的病变是,肾小球毛细血管扩张及血栓形成,毛细血管内血栓形成及基底膜增厚,中性粒细胞浸润及肾球囊上皮细胞增生,毛细血管壁纤维素样坏死,毛细血管内皮细胞及系膜细胞增生,病理学,单选,十门联考,E,书中原话
70115,关于原发性肺结核下列哪项正确,仅发生于儿童,常见的死因是结核性脑膜炎,主要经支气管播散,不经治疗难以痊愈,急性全身播散性结核病不如继发性结核病常见,病理学,单选,十门联考,B,按书中原话，A选项应为多发于儿童也偶见青少年或成人，C选项应为通过血道和淋巴道播散，D选项应为95%病例不再发展，只有极少数患儿会继续发展，E选项应为急性全身播散性结核病可见原发性肺结核也可见继发性肺结核。故只有B项正确。
70116,不符合艾滋病的描述是,很少合并结核病,潜伏期长,T4细胞数下降，T4/T8比例倒置,多发性机会感染,多器官受累,病理学,单选,十门联考,A,HIV感染潜伏期长，一般认为数月至10年或更长时间，血液检测可显示淋巴细胞明显减少尤其以CD4+T细胞减少为著，并且多发机会性感染是本病的其中一个特点，其感染范围广，可累及各器官，以中枢神经系统、肺、消化道受累最为常见。因此B、C、D、E选项正确。肺部结核菌感染，很少形成典型的肉芽肿性病变，而病灶中的结核杆菌却甚多。故A选项错误。
70117,梗死灶呈不规则的地图状，发生于,肺,肾,心,小肠,脾,病理学,单选,十门联考,C,书中原话
70118,甲状腺乳头状癌的病理组织特点是,癌细胞大小不一，可见奇异的巨核细胞,乳头分之多，被覆上皮细胞核呈毛玻璃样,癌细胞圆形或多边形，分泌降钙素,滤泡上皮具有不同程度的异型性，浸润被摸和血管,滤泡大小不一，间质增生形成间隔,病理学,单选,十门联考,B,书中原话B项正确
70119,炎症的防御反应主要表现在炎症的局部病灶有,实质细胞增生,血管扩张充血,炎细胞浸润,肉芽组织形成,纤维化,病理学,单选,十门联考,C,无
70120,腹股沟斜疝在手术时主要诊断依据是,疝囊不在直疝三角内,疝囊在腹壁下动脉内侧,疝囊在耻骨结节下方,疝囊在腹股沟管内,疝囊在腹壁下动脉外侧,病理学,单选,十门联考,E,见腹股沟斜疝与直疝的鉴别表格：斜疝疝囊在腹壁下动脉外侧，而直疝在内侧。
70121,不符合慢性十二指肠溃疡的描述是,多位于十二指肠球部,直径多在1cm以内,易发生癌变,易合并穿孔,易发生出血,病理学,单选,十门联考,C,"C.癌变一般＜1%,多发生于长期胃溃疡患者，十二指肠溃疡几乎不发生癌变。"
70122,高血压病时的肾脏病理变化表现为,颗粒性固缩肾,肾脏单发性贫血性梗死,肾动脉动脉瘤形成,肾的多发性大瘢痕凹陷,肾脏淤血,病理学,单选,十门联考,A,原发性颗粒性固缩肾：肉眼观，双侧肾脏对称性缩小，质地变硬，肾表面凹凸不平，呈颗粒状，切面肾皮质变薄，被膜不易剥离，肾盂和肾周围组织（脂肪）增多
70123,持续性胀痛而逐渐加剧为显著性跳痛，全身感染症状较痛最可能是,肛门周围脓肿,肛裂,内瘘,坐骨直肠窝脓,空,病理学,单选,十门联考,D,坐骨肛门窝脓肿发病时由持续性胀痛发展为持续性跳痛
70124,关于风湿小体组成，下列哪项是错误的,中心纤维素样坏死,粘液样变性,枭眼细胞和毛虫细胞,泡沫细胞,单核细胞核淋巴细胞,病理学,单选,十门联考,D,录音有：泡沫细胞属于动脉粥样硬化时的细胞脂肪变
70125,导致2型糖尿病最重要的因素是,肥胖,肝脂肪变性,肾功能不全,垂体疾病,脂肪和蛋白质代谢异常,病理学,单选,十门联考,A,2型糖尿病即非胰岛素依赖型糖尿病，肥胖者多见（见音频解析）
70126,肛裂患者肛门疼痛的特点描述正确的是,疼痛为隐痛,排便前出现括约肌挛缩痛,排便后出现肛门隐痛并可延续数小时,排便时与排便后疼痛之间有间隙期,疼痛无规律,病理学,单选,十门联考,D,排便时由于肛裂内神经末梢受刺激，立刻感到肛管灼烧样或刀割样疼痛，称为排便时疼痛，便后数分钟可缓解，称为间歇期。故选D
70127,大叶性肺炎是肺肉质变的发生主要是由于,纤维素渗出太多,病变范围广,肺组织破坏严重,细菌毒力过强,吞噬细胞少及功能缺陷,病理学,单选,十门联考,E,大量未能被溶解吸收的纤维素即被肉芽组织取代机化呈褐色肉样外观;C细菌毒力过强会导致肺脓肿及脓胸（可见音频解析）
70128,肺癌的最常见肉眼类型是,中央型,周围型,弥漫型,管内型,管壁浸润型,病理学,单选,十门联考,A,肺癌肉眼类型可分为中央型（60-70%），周围型（30-40%），弥漫型（2-5%）。管内型和管壁浸润型属于中央型早期肺癌。
70129,胃肠道恶性肿瘤多转移至,肝,肺,骨,脑,肾,病理学,单选,十门联考,A,侵入门静脉系统首先发生肝转移。胃肠道恶性肿瘤多经血道转移，血道转移最早转移至肝，因此多转移至肝。（可见音频解析）
70130,急性普通型肝炎主要变化是,肝细胞变性,肝细胞坏死,黄疸为主,无黄疸,点灶状坏死,病理学,单选,十门联考,A,急性（普通型）肝炎镜下肝细胞出现广泛变性，并以细胞水肿为主。坏死是水肿的发展，由于是早期故尚未坏死。
70131,静脉性充血不引起,出血,实质增生,血栓形成,间质增生,器官硬化,病理学,单选,十门联考,B,静脉性充血又称淤血。后果有淤血性水肿、出血、硬化等。（见音频解析）
70132,弥漫性膜性肾小球肾炎的主要病理特点是,肾小球系膜细胞和内皮细胞增生,肾小球基底膜弥漫性增厚并有钉突形成,肾小球系膜细胞增生、基底膜增厚及分层,肾小球硬化,肾小球无明显病变,病理学,单选,十门联考,B,音频解析有：诊断方面以细胞血液为主要诊断依据
70133,诊断癌的最主要的依据是,中老年人,肿瘤呈浸润性生长,多见核分裂象,肿瘤间质丰富,癌细胞呈癌状分布,病理学,单选,十门联考,E,争议应该在B，血管瘤和淋巴管瘤是良性肿瘤但也呈浸润性生长（特例）
70134,恶性葡萄胎与绒毛膜癌主要的区别是,阴道转移结节,浸润肌层,细胞异型性,有绒毛结构,出血坏死,病理学,单选,十门联考,D,绒毛膜癌不形成绒毛。
70135,大叶性肺炎不会发生的合并症有,胸膜炎,脓气肿,败血症,肺褐色硬化,脓毒败血症,病理学,单选,十门联考,D,见大叶性肺叶五项并发症。肺褐色硬化一般见于肺淤血。
70136,急性阑尾炎早期当腹痛未转移至右下腹时，具有诊断意义的体征是（,腹周和上腹痛,右下腹固定的压痛,恶心呕吐,脐周和右下腹压痛,脐周及下腹部压痛,病理学,单选,十门联考,B,急性阑尾炎疼痛转移至右下腹麦氏点进一步发展波及腹膜壁层会伴以压痛；阑尾炎早期局部可无压痛，以后才有右下腹压痛。位于麦氏点压痛标志阑尾病变。
70137,细支气管不完全阻塞所致阻塞性通气障碍可造成,肺不张,肺纤维化,支气管扩张,气胸,脓气胸,病理学,单选,十门联考,E,见肺气肿病因和发病机制
70138,下列最常引起肺心病,慢性支气管炎,支气管扩张,支气管哮喘,慢性肺结核,肺褐色硬变,病理学,单选,十门联考,A,病因和发病机制中，最常引起肺心病的是慢性阻塞性肺疾病，其中又以慢性支气管炎并发阻塞性肺气肿最常见。
70139,湿性坏疽的叙述不正确的是,常见于肺，肠，子宫等内脏器官,坏死组织和周围组织分界不清,由于动脉阻塞，静脉回流正常引起,坏死组织中有大量腐败菌繁殖,全身中毒症状重,病理学,单选,十门联考,C,湿性坏疽：动脉阻塞，静脉淤血水肿。干性坏疽：动脉阻塞，静脉回流正常（可见音频解析）
70140,关于单纯性甲状腺肿，下列错误的是,增生期弥漫性对称性增大，表面光滑,胶质贮积期弥漫性对称性增大，表面光滑,一般无临床症状,一般不伴有功能亢进和功能低下,从病变性质来说，可以看成是良性肿瘤,病理学,单选,十门联考,E,E见肿瘤性增殖与非肿瘤性增殖的区别
70141,疝内容物进入疝囊引起血运障碍的疝为,littre疝,Richer疝,嵌顿疝,肠绞疝,滑疝,病理学,单选,十门联考,D,疝内容物无法回缩的为嵌顿疝，若没有及时解除，肠壁及系膜受压情况不断加重可使动脉血流减少，最后导致完全阻断，即为绞窄性疝。
70142,心肌梗死室壁瘤形成最多发生于,左心室侧壁,室间隔,右心室,左心室前壁近心尖处,左心室后壁,病理学,单选,十门联考,D,D书上原话里3）的第三行
70143,尖锐湿疣是由何种病毒引起的性传播疾病,HIV,EBV,HBV,HEV,HPV,病理学,单选,十门联考,E,HPV可以引起尖锐湿疣
